,zwickau_s_#,similarity_score,london,zwickau
1025,848,0.5026482694908945,et in ipsis crescunt folliculi quidam parui in quibus est lana que colligitur circa festum michah[el]is,lana succida crescit in quibusdam fructetis que alta sunt usque super genua hominis super terram et singulis annis de nouo crescunt uici foliis fere similia et in ipsis crescunt folliculi parui in quibus est lana que colligitur circa festum sancti mich[elis]
1026,850,0.719586041983459,canne mellis similiter ibi crescunt in locis oportunis que sunt similes cannis communibus exterius sed maiores multo,que sunt similes cannis communibus exterius sed maiores multo
1027,851,0.9473894445185,interius non sunt concaue sed omnino plene in quibus est porosa substantia que est disposita sicud illud quod inuenitur in uirgis sambuci,interius uero non sunt concaue sed omnino plene in quibus est porosa substantia que est disposita sicud illud quod inuenitur in uirgis sambuce
1028,852,0.802548832826143,iste canne collecte inciduntur ad longitudinem medie palme et sic exprimuntur in prelo,iste canne collecte inciduntur ad longitudinem dimidie palme tunc exprimuntur in prelo
1029,854,0.5491574548943379,quod expressum fuerit in modum aque dispositum coquitur in caldariis ereis fortissimie spumaque que ex inde colligitur ponitur seorsum in cophinis de subtilibus uiminibus contextis quod grossioris substantie fuit manet in cophinis et siccatum zuccara efficitur,spuma que ex inde colligitur ponitur seorsum in cophinis de subtilibus contextis
1030,856,0.8636412600472276,quod distillat mel est nobilissimum et condiendis cibariis ualde aptum,mel est nobilissimum et condiendis cibariis ualde aptum
1031,857,0.8457800912987123,iste canne inciduntur ad longitudinem unius digiti uel paulominus ita tamen quod iste particule semper nodum in medio habeant qui sunt semper plurimi in una canna,iste canne inciduntur ad longitudinem unius digiti uel paulominus ita tamen quod ille particule semper in medio nodum habeant qui semper sunt plurimi in una canna
1032,858,0.8334824221666456,iste particule subterrantur tempore uerno in locis in quibus possunt per canales et aqueductus continue irrigari et ex illis particulis crescunt noue canne,iste particule subterrantur tempore uerno in locis in quibus possunt per canales et aqueductus continuo irrigari et ex illis particulis crescunt noue canne ita ut de qualibet particula due canne oriantur
1033,859,0.5626288534070544,ita de qualibet particula due canne oriantur singule scilicet ex utraque parte nodi,singule scilicet ex utraque nodi
1034,860,0.5492383006746767,uerum est autem quod in terra ipsa non inueniuntur pira neque poma nisi ualde raro neque cesura neque nuces et fructus alii plures quorum copia est ultra mare,uerum est autem quod in terra ipsa non inueniuntur pira nec poma nisi ualde raro nec cerusa nec nuces et fructus alii plures quorum copia est ultra mare sed de damasco sunt et diu non durant propter nimiam in arbore decoctionem
1035,860,0.5637687798703526,sed de damasco sunt et diu non durant propter nimiam in arbore decoctionem,uerum est autem quod in terra ipsa non inueniuntur pira nec poma nisi ualde raro nec cerusa nec nuces et fructus alii plures quorum copia est ultra mare sed de damasco sunt et diu non durant propter nimiam in arbore decoctionem
1036,861,1.0,sunt tamen quidam fructus ibidem qui per totum annum in arboribus conseruantur et utuntur eis homines toto anno,sunt tamen quidam fructus ibidem qui per totum annum in arboribus conseruantur et utuntur eis homines toto anno
1037,863,0.5819737749091984,simul enim et semel et noui fructus et ueteres sunt in arbore et flores simul cum utroque fructu et ista sunt poma que uocantur naranges et lemones poma ade poma cedrina et quedam alia poma crocea magna ualde in quantitate ad modum magni cantari,et isti sunt poma que uocantur naranges et poma ade poma cedrina et quedam alia poma crocea magna ualde in quantitate ad modum magni cantari de quibus omnibus indigene terre illius faciunt composiciones multas aromaticas et electuaria ualde bona
1038,863,0.5956140276263985,de quibus omnibus indigene terre illius faciunt composiciones multas aromaticas et electuaria ualde bona,et isti sunt poma que uocantur naranges et poma ade poma cedrina et quedam alia poma crocea magna ualde in quantitate ad modum magni cantari de quibus omnibus indigene terre illius faciunt composiciones multas aromaticas et electuaria ualde bona
1039,864,0.9754954777939954,sunt etiam ibi quidam fructus qui dicuntur poma paradysi et crescunt ad quantitatem cophini competenter magni et grossi inferius superius uero acuti et habet unum pomum 500 grana uel plura uel pauciora et sunt grana ista oblonga ad latitudinem 6 digitorum,sunt etiam ibi quidam fructus qui dicuntur poma paradysi et crescunt ad quantitatem cophini competenter magni et grossi inferius superius uero acuti et habet unum pomum 500 grana uel plura uel pauciora et sunt grana illa oblonga ad latitudinem 6 digitorum
1040,866,0.6138687489526484,spissa uero plurimum ad spissitudinem oui gallini folliculum uero habent eadem grana sicut est folliculus fabarum dispositum et eiusdem coloris sed ex omni parte integrum,folliculi uero habent eadem genera sicud est folliculus fabarum dispositum et eiusdem coloris sed ex omni parte integrum qui folliculus apertus abicitur et pomum intus latens tollitur
1041,867,0.5924583133774601,qui folliculus apertus abicitur et pomum intus latens tollitur quod non habet in se semen aliquod sed est molle et album tendens tamen ad aliquam croceitatem et est sapor eius delicatus ualde sicud butyri delicati cum melle,quod non habet in se semen aliquod sed est molle et album tendens tamen ad aliqualem croceitatem
1042,870,0.8857057369020644,arbor autem huius fructus uno anno crescit et fructus facit semel tantum et statim arescit et cum prodire incipit fructus de arbore procedit similis et alia arbor de radice que similiter facit fructum anno sequenti et statim crescit simili modo et arescit et aliam arborem producit et sic deinceps faciunt alie successiue,semel tantum et statim arescit et cum prodire incipit fructus de arbore procedit simul et alia arbor de radice que similiter facit fructum anno sequenti et statim simili modo crescit et arescit et aliam producit arborem et sic deinceps faciunt alie successiue
1043,871,0.6322265702059979,poma ista licet sint magna habent disposicionem tamen botri uinee fere,poma illa licet sint magna habent tamem disposicionem botris uinee fere
1044,872,0.7666609946730132,folia huius arboris longa sunt ad staturam corporis humani et ita lata quod de duabus ante et retro homo posset tegere totum corpus,folia huius arboris longa sunt ad staturam corporis humani et ita lata ut homo de duobus foliis ante et retro posset regere totum corpus
1045,873,0.7648720137974703,de uineis uineas multas habet terra sancta et plures habuit sed quia sarraceni non bibunt uinum non colunt eas sed desertas dimittunt nisi pauci christiani propinquiores qui colunt eas propter questum ut et botros et uina uendant,de uineis uineas multas habet terra sancta et plures habuit sed quia sarraceni non bibunt uinum non colunt eas sed desertas dimittunt
1046,874,0.6315276578637016,et est uinum terre sancte ualde bonum maxime circa lybanum et sydonem,nisi pauci christiani propinquores colunt eas propter questum ut et botros et uinum uendunt et est uinum terre sancte ualde bonum maxime circa lybanum et sydonem
1047,875,0.47797457024002005,in bethlehem est uilla beseleel nomine non longe a neellescol,in bethleem est uilla beseel nomine non longe a neescol unde tulerunt in uecte duo uiri palmitem
1048,875,0.4909855554536396,unde tulerunt in uecte palmitem duo uiri,in bethleem est uilla beseel nomine non longe a neescol unde tulerunt in uecte duo uiri palmitem
1049,876,0.47595369295765155,cuius uille uinum precellit omnia uina terre illius,cuius uille uinum precellit omnia uina terre illius ut frequenter autem circa festum penthecosten habentur botri maturi in terra sancta et durant usque post festum martini et cottidie inueniuntur in foro
1050,876,0.8030006482414013,frequenter autem circa festum pentecosten habentur botri maturi in terra sancta et durant usque post festum martini et cottidie inueniuntur in foro,cuius uille uinum precellit omnia uina terre illius ut frequenter autem circa festum penthecosten habentur botri maturi in terra sancta et durant usque post festum martini et cottidie inueniuntur in foro
1051,877,0.9093036871710828,ficus insuper et malapunica et mel et oleum et diuersa genera leguminum ibidem habundant,ficus insuper et mala punica et mel et oleum et diuersa genera leguminum ibidem habundant
1052,878,1.0,frumentum est ualde bonum et fit inde panis ualde sapidus maxime in ierusalem ubi est panis delicatissimus et optimus quo non gustaui meliorem omnibus diebus uite mee,frumentum est ualde bonum et fit inde panis ualde sapidus maxime in ierusalem ubi est panis delicatissimus et optimus quo non gustaui meliorem omnibus diebus uite mee
1053,879,0.6137647712261107,porci siluestres capreoli lepores uulpes et similes fere multum habundant ibi perdicibus omnino plena est terra ita quod stupor est <ualde> uidere,porci siluestres caprioli lepores et uulpes et similes fere multum habundant ibi
1054,881,0.7132604093297658,sunt etiam ibi leones multi et ursi et cetera genera bestiarum item cameli dromodarii uiridamie,sunt et ibi leones multi et ursi et cetera genera bestiarum
1055,883,0.955128839793541,breuiter ibi habundant omnia bona mundi ita ut possim dicere quod reuera fluit riuis lactis et mellis ut ex hiis omnibus probari potest,breuiter ibi habundant omnia bona mundi ita quod possim dicere quod reuera fluit riuis lactis et mellis ut ex hiis omnibus probari potest
1056,884,0.5953902869457073,de cultoribus cultores non dico fortissimos sed habet pessimos peccatores,sed cultores non dico fortissimos sed pessimos habet peccatores in tantum quod mirum sit quod portat <eos> eos terra
1057,885,0.7809438029831585,sunt in ea habitatores ex omni natione que sub celo est et uiuit quilibet secundum ritum suum,de habitatoribus terre sancte diuersarum nationum sunt in ea habitatores ex omni natione ut credo que sub celo est et uiuit quilibet secundum ritum suum
1058,886,0.37680901498494024,sarraceni mahumetem predicant et legem eius seruant,sarraceni machmetum predicant et legem eius seruant dominum ihesum christum maximum prophetarum dicunt et eundem de spiritu sancto conceptum et de uirgine natum sed nefehler
1059,886,0.7028711976559152,dominum ihesum christum maximum prophetarum dicunt et eum de spiritu sancto conceptum et de uirgine natum sed negant passum,sarraceni machmetum predicant et legem eius seruant dominum ihesum christum maximum prophetarum dicunt et eundem de spiritu sancto conceptum et de uirgine natum sed nefehler
1060,888,0.5544974565785514,sed cum ei placuit dicunt eum ascendisse et sedere ad dexteram <patris> dei maumetem uero ad sinistram,gant passum sed cum eis placuerit dicunt eum in celum ascendisse et sedere ad dexteram dei machmetum uero ad sinistram
1061,889,0.866504258935685,isti sunt inmundi nimis tot habent uxores quod pascere possunt,isti sunt immundi nimis tot habent uxores quod pascere possunt
1062,890,0.9999999999999996,peccant tamen nichilominus contra naturam in singulis ciuitatibus habentes ephebias,peccant tamen nichilominus contra naturam in singulis ciuitatibus habentes ephebias
1063,891,0.7465622983401089,de syris syriani siue siri christianos se dicunt et sunt baptizati sed fere omnes heretici,syriani siue syri christianos se esse dicunt et sunt baptisati sed fere omnes heretici
1064,892,0.8305782851501181,inter sarracenos habitant et committuntur eis officia et procurationes terrarum et in habitu fere concordant cum sarracenis nisi quod tantum per cingulum laneum cognoscuntur,inter sarracenos habitant etiam ut plurimum sunt eis officia et procuratores terrarum commissa et in habitu fere concordant cum sarracenis nisi quod tantum per cingulum laneum cognoscuntur
1065,893,0.6394773324490796,de grecis greci etiam christianos se esse dicunt sed fere omnes sunt scismatici,greci etiam christianos se dicunt sed sunt omnes fere scismatici
1066,894,1.0000000000000002,isti et syriani latinos omnes mortali odio persecuntur,isti et syriani latinos omnes mortali odio persecuntur
1067,895,0.7839343729600101,de aliis gentibus item armeni georgiani nestoriani caldei perse medi ethiopes egiptii nubiani sebeni qui non baptizantur aqua sed igni facientes cum calido ferro signum crucis in facie per longum a fronte usque ad mentum,item armeni georgiani nestoriani caldei perse et medi etyopes egipcii nubiani sebeni qui non baptisantur aqua sed igne facientes de calido ferro signum crucis in facie per longum a fronte usque ad mentum
1068,896,0.6755706261722748,omnes isti et alii plures habitum habent ualde religiosum et in ieumimiis et oratione et deuotione et similibus ita se habent humiliter et deuote quod uidentibus possunt esse in exemplum,omnes isti et alii plures habitum religiosum habent ualde et in ieiuniis et in oratione et deuocione et similibus ita se habent humiliter et deuote ita quod uidentibus esse possunt in exemplum sed sunt omnino peruersi et diuersis heresibus infecti
1069,897,0.7970787965743034,sed sunt omnino peruersi et diuersis heresibus infecti nec de fide uel de doctrina romane ecclesie aliquid audire dignantur sed abhominantur eam horribiliter et contempnunt,nec de fide uel doctrina romane ecclesie aliquid audire dignantur sed abhominantur eam horribiliter et contempnunt
1070,898,0.7106901780715237,loca sancta uisitant cum deuocione magna flent pectora sua tundunt procunbunt orant et ieiunant et cetera similia multa faciunt de genere bonorum sed odium quod gerunt aduersum latinos et romanam ecclesiam non dimittunt,loca sancta uisitant cum deuocione magna flent pectora tundunt procumbunt et orant et ieiunant et cetera similia multa faciunt que sunt de genere bonorum
1071,900,0.7705795873276877,immo ad sarracenos quod oculis meis uidi melius se habent quam ad latinos cuiuscumque etiam sint ordinis uel religionis,ymmo ad sarracenos melius se habent quam ad latinos cuiuscumque etiam fuerit ordinis uel religionis
1072,901,0.8321723388621027,de malitia christianorum preter hec omnia mala que dicta sunt accedit et illud quod ipsi christiani qui habitant in terra sancta ita sunt communiter mali et peccatores ut sint uita indigni,de latinis ibidem habitantibus preter hec omnia mala que dicta sunt accedit et illud quod ipsi christiani qui habitant in terra sancta ita sunt communiter mali et peccatores ut sint uita
1073,902,0.5812748154008877,tot enim fraudes tot tradiciones tot homicida tot dissensiones et adulteria fornicaciones et hiis similia immo peiora committunt,tot enim fraudes tot traditiones tot homicidia dissensiones adulteria fornicaciones et hiis similia ymmo peyora credo quod non inueniantur in una terra ymmo in pluribus ut ita dixerim in toto mundo
1074,902,0.5094608904360156,credo quod non inueniantur in una terra immo in pluribus ut ita dixerim in toto mundo,tot enim fraudes tot traditiones tot homicidia dissensiones adulteria fornicaciones et hiis similia ymmo peyora credo quod non inueniantur in una terra ymmo in pluribus ut ita dixerim in toto mundo
1075,903,0.739376650011672,et hoc ratio ut mihi uidetur cum aliquis fuerit malefactor ut homicida fur latro incestuosus et similibus terminibus irretitus transfretat uel pro penitentia uel quia timet pelli sue et ita in terra sua timet stare et sic de diuersis partibus ut de teutonia francia anglia lombardia illuc uadunt,et hec est ratio secundum quod mihi uidetur inde aliquis fuerit malefactor ut homicida latro incestuosus et similibus terminibus irretitus transfretat uel pro penitentia uel quia timet pelli sue et ita in terra sua timet stare
1076,904,0.526766995253189,sed celum non animum mutant qui transmare currunt,et sic de diuersis partibus ut de theutonia francia anglia lombardia illic uadunt sed celum non animum mutant qui trans mare currunt
1077,905,0.6440682670789332,illuc enim accedentes postquam expenderint allata oportet acquirere noua et sic iterum ad uomitum redeunt committentes peiora prioribus recipientes hospicio peregrinos uenientes de terra sua,illuc enim accedentes postquam expendunt que attulerunt noua conquirere oportet et sic iterum ad uomitum redeunt committentes peiora prioribus
1078,906,0.683490616169179,qui sibi cauere nescientes credunt ipsis tamquam conpatriotis res suas et sic decipiuntur et fraudantur,recipiunt hospicio peregrinos illic uenientes de terra sua qui sibi cauere nescientes credunt ipsis tamquam suis conpatriotis res suas et honorem sed decipiuntur et fraundantur
1079,907,0.8920858820249826,idem itidem generant paternorum criminum imitatores ut de malis parentibus fiant peiores filii et de hiis nepotes pessimi et corrumpuntur et abhominabiles efficiuntur nimis calcantes loca sancta et terram pedibus suis pollutis et uita detestabili,idem generant filios paternorum criminum imitatores et de malis parentibus fiunt peiores filii et de hiis nepotes pessimi et corrumpuntur et abhominabiles efficiuntur nimis calcantes loca sancta et terram pedibus pollutis et uita detestabili
1080,908,0.7475667874513723,unde contingit ut propter peccata inhabitancium terra ipsa et locus sanctificationis apud deum ueniat in conceptum,unde contigit ut propter peccata inhabitancium apud deum terra ipsa et locus sanctificacionis ueniat in contemptum
1081,909,0.7199119108066108,dixit enim mihi patriarcha et uerum fuit quod suo tempore inuenta sunt et descripta 16 000 meretricum in sola ciuitate acconensi preter alias et occultas et similes in matrimonio constitutas quarum statum solus nouit deus,dixit patriarcha et uerum fuit quod tempore suo inuenta sunt et descripta elocati corporis 16 milia meretricium in sola ciuitate achonensi preter alias et occultas et similes et in matrimonio constitutas quarum statum solus nouit deus
1082,910,0.7762045129372311,hiis omnibus sic se habentibus miror quod non extinguit deus scintillam ipsam que relicta est uidens omnes corruptos et abhominabiles factos eo quod non sit qui faciat bonum immo omnis sensus et cogitatio eorum prona sit omni tempore ad malum,hiis omnibus sic se habentibus miror quod non extinguit deus scintillam ipsam que relicta est uidens omnes corruptos <et> et abhominales factos eo quod non sit qui faciat bonum
1083,912,0.7939410038340251,sed uere paciens et misericors deus et miserationes eius super omnia opera eius,sed uere paciens et misericors dominus et miserationes eius super omnia opera eius sit nomen domini benedictum
1084,912,0.46752537769242825,sit nomen domini benedictum,sed uere paciens et misericors dominus et miserationes eius super omnia opera eius sit nomen domini benedictum
1085,913,0.8532573508137619,sunt insuper in terra illa madianite et amalechite qui nunc bodwini dicuntur uacantes tantummodo alendis pecoribus et camelis quibus habundant supramodum,sunt insuper in terra illa madyanite et amalechite qui nunc bodwini dicuntur uacantes tantum alendis pecoribus et camelis quibus habundant supra modum
1086,914,1.0000000000000004,isti non habent certam sedem sed ubicumque sciunt esse pascua se cum tabernaculis suis transferunt et tota familia et deducentes de loco ad locum ipsa tabernacula cum uxoribus et pueris in camelis que et in mediis campis ponunt,isti non habent certam sedem sed ubicumque sciunt esse pascua se cum tabernaculis suis transferunt et tota familia et deducentes de loco ad locum ipsa tabernacula cum uxoribus et pueris in camelis que et in mediis campis ponunt
1087,915,0.8441065789610978,isti sunt pugnatores fortissimi et strennuissimi et pre omnibus armis gladio et lancea utuntur in bello dicentes esse turpe aliquem sagitta hominem interficere quia hoc sit furari uitam eius,isti sunt pugnatores fortissimi et strenuissimi et pro armis omnibus gladio et lancea utuntur in bello dicentes esse turpe aliquem hominem sagitta interficere quia hoc sit furari uitam hominis eius
1088,916,0.9539188786961428,isti sunt dispersi per totam syriam declinantes per arabiam et syriam ubicumque placet et habent de hoc a soldano priuilegium speciale ut plurimum tamen habitant circa fluenta iordanis a lybano usque desertum pharan quia in locis istis sunt montes pro capris et ouibus campi pro bubus et camelis et aquarum copia pro hominibus et pecoribus ad bibendum,isti sunt dispersi per totam syriam declinantes et syriam ubicumque placet et habent de hoc a soldano priuilegium speciale ut plurimum tamen habitant circa fluenta iordanis a lybano usque ad desertum pharan quia in locis illis sunt montes pro capris et ouibus campi pro bubus et camelis et aquarum copia pro hominibus et pecoribus ad bibendum
1089,917,0.7998986527264577,oues sunt ualde magne in sancta terra et arietes habent caudas mirabiles et credo quod uerum est quod ibi communiter dicitur et alibi uix credi potest quia non est uisum quod una cauda 6 uel 7 uel 8 uiris sufficeret ad comedendum,oues sunt ualde multe in terra sancta et arietes habent caudas mirabiles et credo quod uerum est quod communiter ibi dicitur et alibi uix credi potest quia non est uisum quod 1 cauda 6 uel 7 siue etiam 8 uiris sufficeret ad comedendum
1090,918,0.5858372038877361,habet enim aliqua cauda in longitudine 3 uel 5 palmas uel plus in latitudine interdum 1,habet enim aliqua in longitudine 3 uel 5 palmas uel plus in latitudine interdum palmam et dimidiam et sepe duas grossa insuper et pinguis multum que sunt oneri arieti ad portandum
1091,918,0.6754045602228912,5 palmam et sepe duas grossa insuper et pinguis multum que sit oneri arieti ad portandum,habet enim aliqua in longitudine 3 uel 5 palmas uel plus in latitudine interdum palmam et dimidiam et sepe duas grossa insuper et pinguis multum que sunt oneri arieti ad portandum
1092,919,0.6654882035155841,nestoriani habitant terra berichum et biblium in montibus lybani contra ythuream,nestoriani habitant circa byrichum et byblum in montibus lybani contra ythuream
1093,920,0.7637432507338761,maronice habitant circa fontem ortorum in lybano contra tripolim in multitudine copiosa qui habere dicuntur 40000 pugnatorum,maronite habitant circa fontem ortorum in libano contra tripolim in multitudine copiosa qui habere dicuntur ad 40 milia pugnatorum
1094,921,0.8268106729402794,circa arachas castrum et symioym habitant quidam sarraceni qui dicuntur uanini usque ad castrum karach gens crudelis nimis et christianis omnino infesta,circa arachas castrum et synnoym habitant quidam sarraceni qui dicuntur uanyni usque ad castrum krach gens crudelis nimis et christianis omnino infesta
1095,922,0.9124556159999525,illis circa tripolim coniunguntur quidam qui dicuntur assysini usque anterodum prope castrum mergath habitantes in montanis castra plura habentes et ciuitates et terram fertilem ualde,illis circa tripolim coniunguntur quidam qui dicuntur assisini usque anteradum prope castrum mergath habitantes in montanis castra plura habentes et ciuitates et terram fertilem ualde
1096,924,0.5242632651067073,isti dicuntur similiter habere ad 40000 pugnatorum capitaneum eligunt non ex hereditaria successione sed prerogatiua meritorum,capitaneum non ex hereditaria successione sed prerogatiua meritorum qui senex de montanis dicitur non pro etatis sed ingenii maturitate
1097,924,0.658620685825988,qui senex de montanis dicitur non pro etatis sed ingenii maturitate,capitaneum non ex hereditaria successione sed prerogatiua meritorum qui senex de montanis dicitur non pro etatis sed ingenii maturitate
1098,925,0.8020988339032342,isti de persyde dicuntur originem duxisse,isti de perside dicuntur originem duxisse
1099,928,0.59158083235116,obedientes sunt usque ad mortem ex mandato superioris quemlibet interficiunt et ex hoc se paradysum mereri dicunt eciam si antequam obedientiam inpleant occidantur,ex mandato superioris quemlibet interficiunt et ex hoc paradysum se mereri dicunt
1100,930,0.9287977098479954,ante annos paucos ad obedientiam romane ecclesie uenire uolebant et nuncium ad promouendum hoc negocium in achon miserant qui negotio ad uotum peracto cum rediret a quibusdam de templo qui ipsum conducere debebant ante terre sue introitum est occisus in iacturam totius ecclesie quia alii uidentes non esse fidem in christianis statim ab incepto retraxerunt pedem,inde annos paucos ad obedientiam romane ecclesie uenire uolebant et nunccium ad promouendum hoc negocium in achon miserant qui negoci<um>o ad uotum peracto cum rediret a quibusdam de templo qui ipsum conducere debebant ante terre sue introitum est occisus in iacturam tocius ecclesie quia alii uidentes non esse fidem in christianis statim ab incepto retraxerunt pedem
1101,931,0.7222176876587951,terram istorum a terra christianorum quidam lapides passim in campo positi discernunt quibus a parte christianorum insculptum est signum crucis in parte assysinorum cultellus,terram istorum a terra christianorum quidam lapides passim in campo positi discernunt
1102,933,0.9596129645782986,istos nullus soldanorum adhuc potuit subiugare sed ipsi sibi leges et iura condunt et ut libet hiis utuntur,istos nullus soldanorum adhuc potuit subiugare sed ipsi sibi et leges et iura condunt et ut libet hiis utuntur
1103,934,0.9004079583218647,formidabiles autem sunt omnibus per circuitum nationibus propter nimiam feritatem,formidabiles autem sunt omnibus per circuitum nationibus propter nimiam ferocitatem
