,zwickau_s_#,similarity_score,london,zwickau
607,536,0.2178560802513164,item sepulchrum lazari de quo resuscitatus fuit non longe ab ecclesia ubi est facta capella marmorea ualde decens et pulchra et monumentum ipsum marmore tectum in quod etiam descendi,ostenditur ibidem sepulcrum lazari in capella quondam ualde pulcra et sumptuosa marmorea que cum ipso sepulcro multum a sarracenis honoratur
608,706,0.12308105018212012,sarraceni multum honorant sepulchrum istud propter miraculum resuscitationis a domino ibi factum,uidi ego in ecclesia illa miraculum gloriosum
609,546,0.18671789772155162,recedendo a bethania nondum uidetur ierusalem propter montem oliueti interpositum sed ascenditur primo tumor quidam terre et uidetur pars quedam ciuitatis illius dilecte cum monte syon,bethfage de bethania modico interuallo in ualle inter montem oliueti et montem offensionis est bethfage uiculus nunc desertus a sinistris uie que de bethania ducit in ierusalem in latere australi montis oliueti
610,896,0.07760941161530183,eia deus quot deuote lacrime sunt in loco illo fuse uidentes ibi exultationem uniuerse terre ciuitatem regis magni,omnes isti et alii plures habitum religiosum habent ualde et in ieiuniis et in oratione et deuocione et similibus ita se habent humiliter et deuote ita quod uidentibus esse possunt in exemplum sed sunt omnino peruersi et diuersis heresibus infecti
611,1134,0.06054035614824553,quanta erit exultatio uidere locum glorie tue bone ihesu cum locus ignominie et confusionis tue cum tanto tripudio uideatur,2 diebus steti ibi et consideraui totum locum quantum potui diligenter
612,49,0.10290192607198254,sed obmissis omnibus ad ierusalem quantocius ueniamus,prima palestina est cuius metropolis est iherusalem cum omnibus montanis suis usque ad iordanem et mare mortuum secundum limites omnes quos regnum iuda siue iherusalem continebat
613,1100,0.10454381285323626,descenditur igitur de monte et iterum ciuitas dilecta penitus occultatur,ceterum pira poma nuces cerusa prunella penitus non sunt ibi
614,546,0.32526174742201164,itur sub latere orentali montis oliueti iuxta bethfage que ad iactum lapidis dimittitur ad sinistram sub monte offensionis in ualle uiculus ualde paruus ascenditur per latus australe et gyratur mons oliueti,bethfage de bethania modico interuallo in ualle inter montem oliueti et montem offensionis est bethfage uiculus nunc desertus a sinistris uie que de bethania ducit in ierusalem in latere australi montis oliueti
615,640,0.2014157996128274,uenitur ad locum ubi dominus asinum ascendit et continuo resplendet ciuitas tota cum templo et ecclesia sancti sepulchri et ceteris locis sanctis,ecclesia sancti sepulcri ecclesia sancti sepulcri rotunda est et habet per dyametrum inter columpnas 72 pedes preter absides que habent in latitudine 30 pedes
616,838,0.0954397508952414,uenitur ergo ad descensum montis oliueti ubi turbis precedentibus et sequentibus clamantibus osanna filio dauid et letantibus de benedicto eius aduentu ipse uidens ciuitatem fleuit amarissime super illam,de montibus montes autem circa iherusalem sicut erant isti ad orientem ciuitatis contra templum erat mons oliueti maior et altior ceteris montibus qui erant circa illa
617,622,0.1023887394602034,procedamus ergo et inter locum orationis eius in agonia et locum captiuitatis eius in gethsemani transeamus torrentem cedron et sequamur si quomodo concedatur nobis uenire in golgatha ubi steterunt fixi in caute fluentes sanguine pedes eius,gethsemani iuxta capellam siue edificium quod intrasti contra orientem 50 pedes est hostium alterius ecclesie que uocatur gethsemani ubi erat ortus in quem intrauit dominus cum discipulis in latere similiter montis oliueti adherens cuidam rupi concaue de monte dependenti
618,982,0.08544146966364084,moriamur ibi cum christo ut cum ipso pariter resurgamus,si fornicatus fuerit officium et ecclesiam perdet nec cum ipso potest dispensari
619,563,0.23490948681669419,descriptio ciuitatis sancte ierusalem,de magnitudine ierusalem de magnitudine ciuitatis sancte sciendum quod secundum iosephum absque monte syon habuit ambitus ciuitatis per gyrum 33 stadia
620,548,0.5349567009260522,ierusalem igitur ciuitas dei summi de qua dicta sunt et dicuntur cotidie gloriosa sita in terra montuosa,dispositio ciuitatis ierusalem ierusalem ciuitas dei summi domina mundi de qua dicta sunt et dicuntur cottidie gloriosa sita est in terra montuosa habens per circuitum terram fertilem et bonam pre cetera preterquam contra iordanem et orientem
621,333,0.1799445719506626,montes enim sunt in circuitu eius,est autem longa ualde per longum in littore maris sita etiam sunt ibi balnea medicabilia et terra in circuitu fertilis et pinguis et crescunt ibi palme multe
622,548,0.4514745912024756,habet autem per circuitum terram fertilem et bonam preterquam contra orientem et iordanem,dispositio ciuitatis ierusalem ierusalem ciuitas dei summi domina mundi de qua dicta sunt et dicuntur cottidie gloriosa sita est in terra montuosa habens per circuitum terram fertilem et bonam pre cetera preterquam contra iordanem et orientem
623,549,0.4953366610342859,distat ab accon 36 leucis que est contra aquilonem de sobaste siue samaria 16 de sychem 13 de nazareth 27,distat autem ab achon ciuitate leucis 36 que est ipsi ad aquilonem de sebaste siue samaria 16 de sichen 13 de nazareth 54
624,550,0.7536706019670388,hee omnes sunt contra aquilonem,hec omnes sunt contra aquilonem
625,551,0.6088175229750582,de ioppe 13 hec est fere occidentalis parum tamen aquilonaris,de ioppe 13 hec est fere occidentalis declinat tamen aliquantulum ad aquilonem
626,552,1.0,de iericho 7 hec est orientalis,de iericho 7 hec est orientalis
627,553,0.788614195347217,de bethleem 2 de thecua 4 de ebron 8,de bethleem 3 de thecua 4 de ebron 8
628,550,0.3060338671650687,hee sunt contra austrum,hec omnes sunt contra aquilonem
629,556,0.8511935399957257,est autem in decliui latere montis sita dupliciter et ab austro uidelicet et ab occidente ab austro sita est in latere montis syon immo partim in ipso monte partim in eius descensu,de situ ierusalem est autem in decliui latere montis sita dupliciter et ab austro uidelicet et ab occidente habens montes in quibus quasi dependet ab austro sita est in latere montis syon ymmo partim in ipso monte partim in eius descensu
630,557,0.3432696295291973,descendit autem longitudo eius ab ipso monte syon se extendens contra aquilonem,destendit autem longitudo eius ab ipso monte se extendens contra aquilonem ad occidentem uero habet gyon et dependet ab ipso eius latitudo contra orientem usque ad torrentem cedron siue uallem iosaphat et est ciuitas bene magna et non est ut quidam fabulantur in alio loco constructa quam fuerat tempore passionis dominice argumentantes pro parte illa quod cum dominus extra porta ciuitatis passus fuerit et nunc ipse locus sit intra menia ciuitatis sit ideo in alio loco sita
631,557,0.4358499336184414,ab occidente uero habet montem syon et dependet ab ipso eius latitudo contra orientem usque ad torrentem cedron siue uallem iosaphat quod idem est,destendit autem longitudo eius ab ipso monte se extendens contra aquilonem ad occidentem uero habet gyon et dependet ab ipso eius latitudo contra orientem usque ad torrentem cedron siue uallem iosaphat et est ciuitas bene magna et non est ut quidam fabulantur in alio loco constructa quam fuerat tempore passionis dominice argumentantes pro parte illa quod cum dominus extra porta ciuitatis passus fuerit et nunc ipse locus sit intra menia ciuitatis sit ideo in alio loco sita
632,557,0.6354246674879461,et est ciuitas bene magna ut infra dicetur et non est ut quidam dicunt in alio loco sita quam fuerit tempore passionis dominice argumentantes pro parte illa quod cum dominus fuerit extra portam passus et nunc ipse locus sit intra menia ciuitatis sit ideo in alio loco sita,destendit autem longitudo eius ab ipso monte se extendens contra aquilonem ad occidentem uero habet gyon et dependet ab ipso eius latitudo contra orientem usque ad torrentem cedron siue uallem iosaphat et est ciuitas bene magna et non est ut quidam fabulantur in alio loco constructa quam fuerat tempore passionis dominice argumentantes pro parte illa quod cum dominus extra porta ciuitatis passus fuerit et nunc ipse locus sit intra menia ciuitatis sit ideo in alio loco sita
633,558,0.8800540533265304,isti nesciunt quid loquantur et uolunt ea scire que non uiderunt,isti nesciunt quid locuntur et uolunt ea scire que non uiderunt
634,559,0.6307756778850943,situs enim huius ciuitatis talis est et semper fuit quod manente templo domini intra muros ciuitatis stultum fuisset immo omnino impossibile eam ad locum alium transferre propter locorum munitionem ex omni parte cum similem munitionem non posset habere alibi ullomodo,situs enim huius ciuitatis talis est et semper fuit quod manente templo domini intra muros stultum fuisse ymmo stultissimum propter locorum municionem eam ad alium locum transferire cum similem municionem non posset habere ullomodo
635,560,0.9051924957790664,est tamen in rei ueritate in latitudine ampliata et non in longitudine sed manet tota ciuitas antiqua cum monte syon intra muros et habitatur,est tamen in rei ueritate in latitudine amplificata et non in longitudine sed manet tota ciuitas antiqua cum monte syon intra muros et inhabitatur
636,561,0.7541373055518928,sed nunc hoc tempore pauci admodum sunt habitatores pro tante capacitate ciuitatis quia habitatores eius sunt quasi continue in timore,sed nunc tempore ibi pauci sunt habitatores pro tanta capacitate ciuitatis quia habitatores eius sunt continue in timore
637,81,0.17753517199870172,dispositionem tamen eius antiquam quantum fuit possibile indagaui,quamuis autem singulariter dicatur puteus sunt tamen 4 eiusdem structure et dispositionis non tamen eiusdem quantitatis
638,575,0.6210853420535191,erat quidem antiquitus <mons> sicut et hodie mons syon pro parte supereminens ciuitati capax ualde qui etiam per se satis magnam uidetur posse facere ciuitatem,de monte syon erat quidam antiquitus mons sicud et hodie est ab australi parte supereminens ciuitati capax ualde qui etiam per se satis magnam sufficeret facere ciuitatem
639,576,0.7208405236398465,qui mons initium habens a porta aquarum siue fontis syloe contra orientem facit semicirculum per circuitum contra austrum usque ad occidentem ubi erat turris dauid,qui mons initium habens a porta aquarum siue fontis syloe contra orientem facit semicirculum contra austrum per circuitum usque ad occidentem ubi erat turris dauid et erat per totum istum circuitum rupes prerupta que appellabatur mello circa quam leguntur reges iuda plurimum laborasse
640,576,0.49212411378059523,et erat per totum istum semicirculum rupes prerupta et arcus istius semicirculi similiter qui appellabatur mello circa cuius repletionem circa montem syon et ciuitatem inferiorem leguntur reges iuda plurimum laborasse,qui mons initium habens a porta aquarum siue fontis syloe contra orientem facit semicirculum contra austrum per circuitum usque ad occidentem ubi erat turris dauid et erat per totum istum circuitum rupes prerupta que appellabatur mello circa quam leguntur reges iuda plurimum laborasse
641,577,0.914758823516528,turris uero dauid sita erat in quodam colle ipsius prerupte rupis competenter eminenti et uorago ipsa que uenit a parte australi montis syon cingens eam usque ad occidentem ubi tetigit rupem turris dauid statim curuabatur inclinando se ab occidente contra orientem gyrans ipsam turrim,turris uero dauid sita erat in quodam collo ipsius prerupte rupis competenter eminenti et uorago ipsa que uenit a parte australi montis eiusdem cingens eam usque ad occidentem ubi tetigit rupem turris dauid statim incuruabatur inclinando se ab occidente contra orientem gyrans ipsam turrem
642,578,0.7835630679278924,et ita erat turris in rupe et in quodam angulo uoraginis illius constituta,et ita erat turris in rupe et in quodam angulo constituta
643,579,0.2843139146454048,uallis autem siue uorago que ipsam cingebat diuidebatur in duas ualles profundas quarum una procedebat contra aquilonem alia contra orientem,uallis autem siue uorago que ipsam cingebat descendebat iterum ab aquilonale montis syon separans ab ipso inferiorem ciuitatem usque ad latus australe montis moria in quo templum domini situm erat ubi nunc est et tunc fuit porta aquarum
644,578,0.23948913334090582,et iste due ualles faciebant alium angulum oppositum angulo in quo erat turris dauid sita et iste angulus erat de ciuitate inferiori sicut infra dicetur,et ita erat turris in rupe et in quodam angulo constituta
645,579,0.3225917692937534,uallis igitur illa que de turri dauid descendebat in preceps contra orientem descendebat utique in latere aquilonali montis syon usque ad montem moria in quo erat templum separans a monte syon ipsum montem moria et totam inferiorem ciuitatem,uallis autem siue uorago que ipsam cingebat descendebat iterum ab aquilonale montis syon separans ab ipso inferiorem ciuitatem usque ad latus australe montis moria in quo templum domini situm erat ubi nunc est et tunc fuit porta aquarum
646,579,0.2549194398310219,et descendebat uorago ista adhuc ultra usque in torrentem cedron per locum ubi nunc est porta aquarum inter montem syon et palacium salomonis quod edificatum fuit in parte australi montis moria,uallis autem siue uorago que ipsam cingebat descendebat iterum ab aquilonale montis syon separans ab ipso inferiorem ciuitatem usque ad latus australe montis moria in quo templum domini situm erat ubi nunc est et tunc fuit porta aquarum
647,582,0.18250090619505877,et ita uorago ista antiquitus ex omni parte cingebat montem syon,ab ista ualle siue uoragine bono interuallo a turre dauid contra occidentem erat procedens alia uorago habens a parte occidentis altam rupem similiter eminentem super quam murus ciuitatis erat edificatus que cingebat ciuitatem a parte occidentis
648,580,0.5499555160760989,hec erat ciuitas dauid,et est ibi diuisio inter montem syon hec erat ciuitas dauid
649,581,0.20572280384596944,uerum nunc uorago ista tota est repleta,uorago illa nunc repleta est sed adhuc possunt uestigia eius in aliquibus locis deprehendi
650,581,0.3421778366377906,possunt tamen adhuc eius uestigia aliqualiter deprehendi,uorago illa nunc repleta est sed adhuc possunt uestigia eius in aliquibus locis deprehendi
651,582,0.2814287770653836,secunda uorago siue uallis que diuidebatur ab ista sub turre dauid sicut dictum est supra procedebat contra aquilonem et faciebat fossatum ciuitatis a parte occidentis circa totam longitudinem ciuitatis usque in finem eius in parte aquilonis,ab ista ualle siue uoragine bono interuallo a turre dauid contra occidentem erat procedens alia uorago habens a parte occidentis altam rupem similiter eminentem super quam murus ciuitatis erat edificatus que cingebat ciuitatem a parte occidentis
652,583,0.3647366677946472,et supra eam per totum erat interius rupes eminens quem iosephus appellat acram super quam erat murus ciuitatis positus qui cingebat ab occidente ciuitatem usque ad portam effraym et ibi curuabatur iterum contra orientem usque ad portam anguli que erat constituta in angulo ciuitatis qui erat contra angulum aquilonis et orientis,qui murus incipiebat sub monte syon a parte aquilo[nal]is et procedebat contra aquilonem usque ad portam effraym et ibi curuabatur contra orientem usque ad portem anguli et iterum curuabatur contra austrum per portam sterquilinii et uallis et ante atrium templi transiens domum regis usque ad portam uallis fontis syloem
653,583,0.30870672109241193,et ibi iterum murus curuabatur de aquilone per orientem contra austrum extra aream templi includens illam et domum regis et portam fontis siue aquarum iuxta montem syon ad orientem,qui murus incipiebat sub monte syon a parte aquilo[nal]is et procedebat contra aquilonem usque ad portam effraym et ibi curuabatur contra orientem usque ad portem anguli et iterum curuabatur contra austrum per portam sterquilinii et uallis et ante atrium templi transiens domum regis usque ad portam uallis fontis syloem
654,584,0.7706099685399219,et iste erat totus ambitus ciuitatis,et ille erat totus ambitus ciuitatis
655,585,0.31280620151313826,rupes autem illa supra quam ut dictum est ante ex parte occidentis erat murus ciuitatis edificatus erat eminens ualde et maxime in angulo ubi occidentalis pars muri coniungebatur cum aquilonali,de parte occidentali rupes autem predicta supra quam ut dictum est erat murus ciuitatis edificatus a parte occidentis erat uehementer alta et de ea dependebat latitudo ciuitatis inclinans se paulatim usque ad murum orientalem ciuitatis que erat supra torrentem cedron ubi ciuitas ipsa erat plurimum tunc et est hodie dimissa unde et ibi sordes ciuitatis per portam sterquilinii egrediebantur et descendebant in torrentem cedron
656,106,0.1450358927348215,ille enim locus erat magis eminens et ibi erat edificata turris que dicebatur nebulosa et castellum ualde firmum cuius adhuc ruine sunt ibi,aliud est castrum in colle situm similiter ualde firmum
657,594,0.11159142264496073,et uidetur inde tota arabia et iordanis et mare mortuum et alia loca multa quamuis quidam uelint dicere quod turris nebulosa fuerit iuxta templum quod oportunitas loci et decliuitas non admittit,huic adheret turris ananeel in parte aquilonali que etiam nebulosa siue turris afel dicitur
658,585,0.6280368587291293,de ista rupe ex parte occidentis ut dictum est uehementer alta dependebat latitudo ciuitatis inclinans se paulatim usque ad murum orientalem qui erat super torrentem cedron ubi ciuitas ipsa erat tunc et est hodie dimissior,de parte occidentali rupes autem predicta supra quam ut dictum est erat murus ciuitatis edificatus a parte occidentis erat uehementer alta et de ea dependebat latitudo ciuitatis inclinans se paulatim usque ad murum orientalem ciuitatis que erat supra torrentem cedron ubi ciuitas ipsa erat plurimum tunc et est hodie dimissa unde et ibi sordes ciuitatis per portam sterquilinii egrediebantur et descendebant in torrentem cedron
659,825,0.4286863847293224,unde et ibi sordes ciuitatis per portam sterquilinii defluebant in torrentem cedron,porta sterquilini quinta porta erat ab ista contra orientem similiter supra torrentem cedron dicta porta sterquilini quia tempore pluuie sordes ciuitatis descendebant per eam in torrentem cedron
660,586,0.7679190192453118,extra uoraginem autem siue uallem sepius supra dictam ex parte occidentis ad sinistram exeuntibus de porta ueteri siue iudiciaria fuit dominus crucifixus et post passionem eius longo tempore uorago illa repleta est et murus alius circumductus a turre dauid usque ad portam effraym que nunc beati stephani appellatur,golgata extra uoraginem autem siue uallem supra dictam ex parte occidentis extra portam ueterem siue iudiciariam fuit dominus crucifixus et post passionem eius longo tempore uorago illa repleta est et murus alius circumductus a turre dauid usque ad portam effraym que nunc porta sancti steffani dicitur
661,587,0.7246775796560518,uides itaque quod ab austro mons syon ab occidente uero rupes illa que erat pars montis syon qui contra occidentem in latitudine plurimum se extendit supereminebant urbi et sub ipsis duobus contra orientem et aquilonem tota ciuitas quasi in decliui montis latere dependenbat,uides igitur quod ab austro mons syon ab occidente uero rupes illa que erat pars montis gyon qui extra occidentem in latitudine se plurimum extendebat supereminebat urbi et sub ipsis duobus montibus contra orientem tota ciuitas quasi in decliui latere montis dependebat
662,588,0.6458241634100349,item mons moria in quo templum domini et palacium regis edificata erant aliquantulum erat altior ciuitate quod patet ex situ templi et atriorum secundum quod iosephus dicit et describuntur singula in hystoriis,de monte moria item mons moria in quo templum domini et palacium regis edificata fuerant aliquantulum erat altior inferiori ciuitate quod patet ex situ templi et atriorum secundum quod nunc omnia sunt complanata et fere demissiora tota ciuitate
663,588,0.3470840595607247,que loca nunc omnino sunt complanata et fere dimissiora tota ciuitate,de monte moria item mons moria in quo templum domini et palacium regis edificata fuerant aliquantulum erat altior inferiori ciuitate quod patet ex situ templi et atriorum secundum quod nunc omnia sunt complanata et fere demissiora tota ciuitate
664,589,1.0000000000000002,depositus enim fuit mons templi per romanos et missus in torrentem cedron cum omnibus ruinis templi et atriorum quod hodie palam est uidere,depositus enim fuit mons templi per romanos et missus in torrentem cedron cum omnibus ruinis templi et atriorum quod hodie palam est uidere
665,590,0.8482616373464384,area uero templi quadrata est habens in longitudine et latitudine plusquam iacere possit arcus,area templi quadrata est et habet in longitudine et latitudine plusquam iacere possit arcus
666,591,0.7602785247970659,templum uero quod nunc in ea edificatum est adheret muro ciuitatis fere quod non fecit uerum et antiquum templum quia quatuor atria erant intermedia sed modo non distat a muro torrenti cedron imminenti nisi forte 30 pedibus,templum uero quod nunc edificatus est in ea adheret muro ciuitatis fere quod non fecit uerum et antiquum templum quia 4 atria erant intermedia sed modo non distant a muro torrenti cedron inmminenti per 30 pedes
667,592,0.7161438196646139,non longe ab area templi contra aquilonem scilicet minus quam iactus sit lapidis est porta uallis quia per eam descendebatur in uallem iosaphat,porta uallis non loge ab area templi contra aquilonem minus quam est iactus lapidis est porta que dicebatur porta uallis quia per eam descendebatur et adhuc descenditur in uallem iosaphat
668,593,0.799018983858083,dicebatur etiam porta gregis quia per eam introducebantur greges immolandi in templo,dicebatur etiam porta gregis quia per eam greges immolandi in templo adducebantur
669,594,0.3035322720043033,huic adherebat turris quam quidam putabant turrim nebulosam uel anancelis sed erat turris phaselus cuius adhuc apparent uestigia,huic adheret turris ananeel in parte aquilonali que etiam nebulosa siue turris afel dicitur
670,596,0.5868339805461991,intrantibus autem portam uallis siue gregis statim ad sinistram iuxta aream templi occurrit piscina probatica in qua nazarei lauabant hostias et sic eas sacerdotibus presentabant in templo offerendas,de piscina probatica intrantibus ante portam uallis ad sinistram iuxta aream templi in latere eius aquilonali occurrit piscina probatica in qua nathynnei lauabant hostias et sic eas sacerdotibus presentabant et hec adhuc 5 porticos habuisse ostenditur in quibus secundum iohannem iacebant infirmi exspectantes aque motum
671,596,0.48261770646601493,hec adhuc ubi porticus habuisse ostenditur in quibus secundum iohannem iacebant infirmi exspectantes aque motum,de piscina probatica intrantibus ante portam uallis ad sinistram iuxta aream templi in latere eius aquilonali occurrit piscina probatica in qua nathynnei lauabant hostias et sic eas sacerdotibus presentabant et hec adhuc 5 porticos habuisse ostenditur in quibus secundum iohannem iacebant infirmi exspectantes aque motum
672,597,0.8098623354668137,ad dextram uero uie predictam portam intrantibus in ecclesia sancte anne ostenditur alia piscina grandis que dicebatur piscina interior quam fecit ezechias hoc modo obcurauit superiorem fontem aquarum gyon et auertit aquas eius subter ad occidentem urbis dauid per uallem paulo ante dictum incidens ferre petram sicut dicitur ecc,de piscina interiori ad dextram uero uie per predictam portam intrantibus in ecclesiam sancte anne ostenditur alia piscina grandis que dicebatur piscina interior quam fecit ezech[iel] hoc modo obturauit superiorem fontem aquarum gyon et auertit aquas eius similiter ad occidentem turris dauid per uallem paulo ante dictam incidens ferro petram sicud dicitur ecc
673,598,0.7295049641023313,et inducens aquas per medium ciuitatis in piscinam istam ut in obsidione haberet aquam populus ad bibendum et eos non possent assyrii prophentii prohibere,et inducens aquam per medium ciuitatis in piscinam istam ut in obsidione aquam haberet populus ad bibendum et eas non posset assirii prohibere
674,599,0.7524444699878816,fontem uero aquarum gyon inferiorem qui non longe distabat ab agro fullonis duxit in superiorem que est supra natatoriam syloe,de piscina superiori fontem uero aquarum gyon inferiorem qui non longe distat ab agro fullonis duxit in piscinam superiorem que est iuxta natatoria syloe
675,600,0.6305489039299155,hoc achar inceperat sed non perfecerat,hanc achas inceperat sed non perfecit
676,461,0.16781834787514255,de hac piscina et de hoc fonte et eius situ dictum est illud ys,de ea est illud iere
677,601,0.35577989028517265,egredere ad extremum aqueductus piscine superioris in uia agri fullonis,de secundo tamen hoc est inferiori fonte aquarum gyon intellige dictum illud ysaie egredere ad dextram aqueductus piscine superioris
678,602,0.463938155874873,est enim ista piscina et dicitur superior respectu natatorie syloe quia ipsa natatoria syloe de ista piscina et de fonte syloe recipit aquam tamquam inferior,est enim superior respectu piscine siue natatoria syloe que sub ipso sita est recipiens ab ea et a fonte syloe aquam
679,604,0.5613791546078332,et nota de diuersitate istarum piscinarum et nominibus earum prima et precipua piscina in ierusalem erat piscina probatica 5 porticus habens,una que erat prima et precipua piscina probatica 5 porticos habens
680,605,0.2855399302252226,hanc fecit saleron pro ministerio templi,hanc fecit salomon de ea dictum est supra
681,324,0.3031528239800992,de hac dictum est supra,inde ad  leucam est dothaim de qua dictum est supra
682,606,0.6886571301129887,secunda fuit iuxta illam contra aquilonem in ecclesia sancte anne et dicebatur interior,alia erat iuxta illam contra aquilonem in ecclesia sancte anne hodie existens que dicebatur interior
