,zwickau_s_#,similarity_score,london,zwickau
290,255,0.6062476840389087,inde ad 4 leucas contra austrum fere sed declinando aliqualiter contra orientem est uilla naason de tribu neptalim in ualle sita de qua legitur in thobia,inde contra austrum ad 4 leucas est naason de tribu neptalim de qua legitur in thobia
291,256,0.6726960327543825,inde ad 3 leucas contra austrum est dothaym ubi ioseph inuenit fratres suos situm sub monte bethulie ad 1 leucam opidum ualde amenum uineis oliuetis et ficubus habundans et pascuis pinguibus,dotayn inde ad austrum ad 3 leucas est dothaim ubi ioseph inuenit fratres suos situm sub monte bethulie <ud> ad 1 leucam opidum ualde bonum amenum uineis et oliuetis et ficetis et pascuis
292,257,0.4057802830240318,ibidem adhuc in campo ostenditur cysterna in qua fuit missus ioseph quam etiam ibi uidi iuxta uiam que de galaad ueniens coniungitur in bethsayda cum uia que de syria ducit in egyptum ascendens de dothaym iuxta montem bethulie et inde per campum esdrelon procedens sub monte thabor ad sinistram per campum magedo ascendit montem effraym uenit in ramatha sophim per gazam ducit in egyptum,ibidem adhuc in campo ostenditur cisterna ioseph et uia que ducit in egiptum de syria non longe distat a cisterna procedens inde per uiam dothaym et ad montana conscendens transit per planiciem galilee iuxta montem thabor per campum et uillam maggedo ascendens usque ad montem effraim uenit in ramathasophin et inde per terram philistim in egiptum
293,258,0.7921054332942606,per hanc uiam uenerunt ysmahelite qui emerunt ioseph,per hanc ueniunt ysmahelite qui emerunt ioseph
294,259,0.29259355815285115,de ista uilla dothaym legitur 4 regum quod syri in ea uallauerunt heliseum qui eos inde duxit ad medium samarie que distat inde fere per 1 dietam,in eodem opido dotayn heliseus uallatus a syris duxit eos ad medium samarie que inde distat per bonam dietam
295,260,0.8237239331376879,nota tamen quod dothaym non solum est uilla sed etiam contracta ab ipsa uilla dicta quia illi ab antiquo adiacet sita in terra campestri inter montes hinc inde non multum altos irrigua fontibus et ideo pascuosa et alendis pecoribus apta,nota tamen quod dothain non solum est uilla sed contracta ab eadem uilla sic dicta quia illi adiacet sita in terra campestri inter montes hinc inde non multum altos irrigua fontibus et ideo pascuosa et alendis pecoribus apta
296,262,0.38035101381187836,de nason 2 leucis contra orientem de dothaym 3 contra aquilonem est ciuitas neptalim de qua fuit thobias firmo loco ualde sita,neptalim thobie de naason 2 leucis contra orientem de dotaym 3 leucis contra aquilonem neptalyn est ciuitas thobie nunc casale ualde modicum sed alto loco situm non longe a sephet nunc dicitur syrin
297,1054,0.21000821005319853,habet enim ab occidente montem altum ualde et penitus inaccessibilem nisi a parte orientis per breue spacium,terra egypti fere inaccessibilis est
298,563,0.14035273709086943,hanc puto tempore excidii secundum iosephum iocapatam dictam,de magnitudine ierusalem de magnitudine ciuitatis sancte sciendum quod secundum iosephum absque monte syon habuit ambitus ciuitatis per gyrum 33 stadia
299,184,0.3285137574343268,in qua idem iosephus obsessus fuit a romanis et captus ut ipse testatur,hanc munierat iosephus tempore discidii contra romanos et in ea obsessus et captus fuit sicud ipse testatur narrans multa de preconio huius ciuitatis et monstrantur diricie eius usque in presentem diem
300,227,0.11754428895407502,nunc syrin dicitur et distat de sephet parum plus quam per leucam,inde contra aquilonem fere ultra uallem semnim 4 leucis de sephet est cedes neptalim
301,263,0.5904087421991324,de neptalim per 2 leucas in angulo maris galilee ubi idem ab aquilone curuari incipit contra austrum sita est bothsaida ciuitas andree et petri et philippi nunc uix habet 6 domos iuxta uiam que de syria ducit in egyptum,bethsaida de neptalim 2 leucis contra orientem supra mare galilee est bethsaida ciuitas andree petri et phillippi nunc uix habet 6 domos iuxta uiam que ducit ad occidentem cui coniungitur uia que de syria ducit in egiptum et est sita uia ista in cornu maris galilee ubi sanctum ipsum mare curuari incipit ab aquilone in austrum
302,358,0.17144918522445826,habuit antiquitus aqueductum de fluuio quem iosephus uocat paruum iordanem et medio loco inter ipsam et capharnaum ingreditur mare galilee,etiam extenditur mons ille in longitudine contra mare galilee 4 miliaribus et terminatur non longe a loco ubi iordanis mare galilee ingreditur
303,814,0.6941546251003355,huius uestigia adhuc apparent,huius uestigia adhuc in antiquo apparent
304,264,0.6905064555885256,inde 2 leucis contra meridiem est magdalum castellum marie magdalene cuius domum adhuc uidi ibidem et intraui,magdalum inde 2 leucis contra meridiem magdalum castellum maria magdalene similiter in littore maris situm cuius domum ibidem uidi et intraui
305,265,0.6634374803706925,situm est autem in litore maris distans a bethulia 2 leucis contra uulturnum fere et habet a parte occidentis et aquilonis planiciem magnam et pascuosam,distat a bethulie et dothaym 2 leucis contra uulturnum fere ameno loco situm et habet a parte occidentis et aquilonis planiciem magnam et amenam et pascuosam
306,207,0.15356528826825036,et nota quod ista quarta diuisio non habet uillas aliquas amplius circa mare galylee sed in alio eius litore sunt ciuitates et castella plura ad hanc diuisionem pertinentia in terra gecasenorum que hinc directe est opposita,de diuisione quarte orientalis
307,50,0.1084932491101496,in hac sunt ciuitates plures ut gerasa gadera pella suecha a qua fuit baldach suithes theman a qua ebifar thomanites et plures alie,in hac palestina erant episcopi plures et archiepiscopi et ciuitates munite ualde
308,336,0.1804749649598294,gerasa tamen ciuitas sita est in litore maris galylee sub monte seyr contra tyberiadem fere sed modico declinans ad aquilonem et erat de tribu manasse dimidia que ultra iordanem sortem acceperat,in longitudine uero protenditur a ciuitate tyberiade et toto littore aquiloni maris galylee usque in damascum
309,23,0.1811741394619958,et nota quod tota terra ista ultra mare galylee montuosa est ualde ut mihi uidetur quia eam non intraui et erat de regno regis basan pro parte et pro parte aliqua dicitur mons seyr quia esau ibi habitauit ut statim dicetur,sciendum autem in principio quod terra ista quam sanctam dicimus que cecidit in sortem 12 tribuum israel pro parte aliqua dicebatur regnum iudee quia erat 2 tribuum scilicet iude et beniamin pro parte altera dicebatur regnum samarie scilicet ciuitatis illius que nunc sebaste dicitur et erat caput et metropolis 10 tribuum reliquarum que israhel dicebantur
310,584,0.15464405129340777,dicebatur insuper alibi mons suanir quia ille erat in ea,et ille erat totus ambitus ciuitatis
311,212,0.2211428289584542,item dicebatur mons hermon qui similiter illuc erat et ita pro diuersis locis et montibus diuersis erat terra ista nominibus appellata,item mons swanir et hermon supra mare galilee usque in baalgad et inde usque ad introitum emath ubi accedit lybanus sunt continua montana quasi mons unus sed in diuersis locis diuersis nominibus appellatur sicut palam est uidere in alpibus que separant lumbardiam et theutoniam et hartone inter saxoniam et <churiginsiam> et thuringiam
312,291,0.23243966897180343,tota tamen cessit in partem dimidie tribus manasse sed nunquam totam eam possedit quia filii esau habitant in ea pro parte usque in presentem diem,mons nota quod terra que est a parte australi huius uie usque ad possessionem dimidie tribus manasse que erat in basan et edrayn ciuitatibus et turris ogis regis basan dicitur mons seyr siue ydumea siue etiam edom et habitauit in ea esau et posteri eius usque in presentem diem sed appellantur communiter sicud alii sarraceni quia nec lingua nec habitu nec ritu distant ab eis
313,291,0.2545111447095857,appellantur tamen comuniter sarraceni quia nec ritu nec lingua discrepant ab eis nisi forte tonsura et uestitu,mons nota quod terra que est a parte australi huius uie usque ad possessionem dimidie tribus manasse que erat in basan et edrayn ciuitatibus et turris ogis regis basan dicitur mons seyr siue ydumea siue etiam edom et habitauit in ea esau et posteri eius usque in presentem diem sed appellantur communiter sicud alii sarraceni quia nec lingua nec habitu nec ritu distant ab eis
314,292,0.46560282765658073,hoc tamen sciendum quod adhuc est alius mons seyr siue edam contra desertum maris rubri de quo dicitur genesis 24 quod codorlahomor et alii reges cum eo percusserunt thorreos qui habitabant in monte seyr qui tunc utique non dicebatur mons seyr quia esau qui seyr dictus est et a quo mons iste est appellatus non dum erat natus,est tamen alios mons seir siue edon contra desertum maris rubri de quo dicitur genesis 33o quod chodorlaomoris et alii reges cum eo percusserunt horreos qui habitant in monte seyr
315,661,0.1842481173821804,unde per antycipationem creditur esse dictum item deut,alia pars creditur esse in constantinopoli
316,293,0.8181320974258799,2 transibitis per terminos fratrum uestrorum filiorum esau qui habitant in seyr et timebunt uos,item [in] deuteronomio secundo transibitis per terminos fratrum uestrorum filiorum esau qui habitant in seyr et timebunt uos
317,309,0.15919524426973042,hoc primo dictum fuit filiis israel uenientibus de egypto cum essent in cades barne uenturis ad montem seyr qui est iuxta cades barne ubi tunc erant,de regno moab postea sequitur terra filiorum amon in eodem litore quam diu durat mare mortuum et sic circuithtus eius <h> australe usque ad montem seyr alium qui coniunctus est deserto pharan usque cades barne habens a latere desertum synai
318,294,0.748285971219056,sed certum est quod ad terminos huius montis seyr qui est supra mare galilee numquam accesserunt filii israel cum exirent de egypto quia iste mons seyr coniungitur cum damasco quo nunquam peruenerunt,certum est autem quod ad terminos huius montis seir qui est supra mare galilee numquam accesserunt israel cum exirent de egipto quia ista terra coniungitur cum damasco quo unquam peruenerunt
319,295,0.3934876784871929,alius autem mons seyr de quo ibi loquitur coniungitur cum deserto faran quem longo tempore circuierunt filii israel prohibiti a domino eum intrare et de illo monte seyr dicitur etiam deut,alius mons seyr coniungitur cum deserto pharan quem longo tempore circuierunt et de illo dicitur deuteronomius 3o in monte seyr olim habitauerunt horrei quibus eiectis atque deletis habitauerunt filii esau pro eis
320,295,0.6746909741357795,2 in monte seyr olim habitauerunt chorrei quibus eiectis atque deletis habitauerunt filii esau pro eis,alius mons seyr coniungitur cum deserto pharan quem longo tempore circuierunt et de illo dicitur deuteronomius 3o in monte seyr olim habitauerunt horrei quibus eiectis atque deletis habitauerunt filii esau pro eis
321,296,0.7363477473728693,in isto autem monte seyr qui est iuxta mare galylee et montem galaad habitabat esau eo tempore quo iacob rediit de mesopothamia syrie,in isto autem monte seyr siue ydumea habitabat esau eo tempore quo iacob rediit de mesopothamia syrie
322,297,0.7277316137921926,dicitur enim in genesis quod esau qui habitabat cum patre suo absque dubio in bersabee assumptis omnibus que habebat abiit in alteram regionem,sicud scriptum est genesis 11 quod esau qui cum patre absque dubio habitabat in bersabee assumptis omnibus que habebat abiit in alteram regionem
323,298,0.32590650632530066,nulli dubium quin ad istam et separatus est a fratre suo,nulli dubium quin ad istam unde et iacob redeunti de mesopothamia occurrit iuxta uadum iaboth quod ab austro adiacet terre ille
324,298,0.7560455635973182,unde et iacob redeunti de mesopothamia occurrit iuxta uadum iabech quod ab austro adiacet terre isti,nulli dubium quin ad istam unde et iacob redeunti de mesopothamia occurrit iuxta uadum iaboth quod ab austro adiacet terre ille
325,299,0.5826039134178365,et genesis 33 dicitur quod cum lacob transiuisset phanuel ortus est ei sol et infra eleuans autem oculos uidit uenientem esau,et genesis dicitur 33o quod cum iacob transiui<si>sset phanuel ortus est ei sol et ibi eleuatis oculis uidit uenientem esau
326,300,0.7806911124925618,qui locus scilicet phanuel ostenditur hodie eodem nomine non longe a sophet ultra iordanem ad orientalem plagam ubi legitur postea immediate uenisse,qui locus scilicet phanuel ostenditur hodie eodem nomine non longe a sochot ultra iordanem ad orientalem plagam ubi legitur iacob inmediate post uenisse
327,301,0.5961148779496751,et est locus idem in montis pede seyr qui adiacet mari galilee cum ille mons seyr in quo olim habitauerunt chorrei pro quibus nunc ibidem habitant filii esau,et est locus idem in pede montis seyr qui adiacet mare galilee in quo habitauerunt horrei pro quibus etiam nunc habitant filii esau sicut dictum est
328,302,0.6706381922010095,per plures dietas distet a loco isto a quo non poterat uenisse subito esau pro fratre suo uidendo quia longe ultra mare mortuum distat fere per 10 dietas,per plures dietas distat a loco illo a quo non poterat uenisse esau pro fratre suo uidendo quia multum distat
329,303,0.5878172719462873,hec diuersitas filiorum esau uidetur mihi accidisse et habitationum diuersitas ex eo quod esau plures habuit uxores et ita filii quos habuit de filia ismahel sorore nabayoth habitauerunt in monte seyr qui est iuxta desertum pharan in confinio illo ubi habitauit socer eius ysmael,hec diuersitas filiorum esau et habitationis eorum uidetur mihi ex eo accidisse quia esau duplices habebat uxores et ita filii quos habuit de filia ysmahel sorore nabaioth habitabant in monte seyr qui est iuxta desertum pharan in quo legitur ysmahel et sui posteri fuisse conuersati
330,292,0.23182464838126157,de quo dicitur gen,est tamen alios mons seir siue edon contra desertum maris rubri de quo dicitur genesis 33o quod chodorlaomoris et alii reges cum eo percusserunt horreos qui habitant in monte seyr
331,1018,0.1426363742882475,quod factus est uir gnarus sagittandi et moratus in solitudine pharan ubi legitur ipse et eius posteri conuersati,de gulfo isto in rasecasse que est prima ciuitas egipti in solitudine pharan et inde pharamiam ciuitatem pulcram et munitam sed non habitat in ea homo quia serpentes eiectis habitatoribus eam penitus possederunt
332,303,0.09500756824509102,duxit autem esau alias uxores absque hiis quas prius habuerat inter quas una erat colibama filia ane filii sebeon euehi,hec diuersitas filiorum esau et habitationis eorum uidetur mihi ex eo accidisse quia esau duplices habebat uxores et ita filii quos habuit de filia ysmahel sorore nabaioth habitabant in monte seyr qui est iuxta desertum pharan in quo legitur ysmahel et sui posteri fuisse conuersati
333,296,0.24465335591451998,iste euehus filius erat chanaan et habitabat absque dubio in partibus scitopoleos in galilea iuxta montes gelboe non longe a mari galilee cui loco uicinus est ualde mons alius seyr in quo habitabat tempore illo cum iacob rediret de mesopothamia,in isto autem monte seyr siue ydumea habitabat esau eo tempore quo iacob rediit de mesopothamia syrie
334,1124,0.0966665131524128,et ita de facili ibi poterat occurrere fratri suo quod et textus tacite uidetur innuere,tunc non erat tuta nauigatio eo quod esset mensis nouember nec ibi poteramus hyemare propter paupertatem fratrum
335,159,0.09630536792747221,dicitur enim genesis quod recedente laban a iacob ille pergebat cepto itinere et obuios habuit angelos dei et dixit castra dei sunt hec et appellauit nomen loci manaym i[d est] castra qui locus est hodie sub monte galaad in tribu gad et de loco illo misit nuncios ad fratem suum qui ibidem etiam ad eum redierunt,aracheus enim condidit castrum arachas quod est hodie iuxta tripolim et illud suo nomine appellauit
336,136,0.1434289689638399,unde et infra dicitur quod seperauit munera fratri suo de gregibus suis et misit per manus nuciorum,probantur ut infra dicetur
337,595,0.09924396291469875,et dicitur ibi precesserunt itaque munera ipse uero adhuc mansit in castris hoc est in manaym nocte illa cumque mane surrexisset transiuit uadum iaboch qui etiam hodie ostenditur ibi et ecce uir luctabatur cum eo et cetera,huius adhuc manent uestigia
338,136,0.11643602417180475,et infra uocauitque nomen loci illius phanuel,probantur ut infra dicetur
339,464,0.13666082989087444,qui locus est hodie super torrentem iaboch similiter in tribu gad,altera in tribu benyamin
340,299,0.353701999220667,ortusque est ei sol cum transisset phanuel et sequitur leuans autem oculos uidit uenientem esau et cetera,et genesis dicitur 33o quod cum iacob transiui<si>sset phanuel ortus est ei sol et ibi eleuatis oculis uidit uenientem esau
341,301,0.1288515166647671,ecce loca nota ubi uenit ad eum esau que sunt omnino uicina monti isti seyr qui est supra mare galilee,et est locus idem in pede montis seyr qui adiacet mare galilee in quo habitauerunt horrei pro quibus etiam nunc habitant filii esau sicut dictum est
342,69,0.16076563052769707,est adhuc tercius mons seyr in finibus azoti et ascalonis qui ascriptus fuit tribui iuda in distributione terre sed quare sic sit dictus non recolo me legisse,primum igitur sciendum quod ciuitas achonensis nunquam fuit terra sancta nec a filiis israel possessa licet in distributione terre tribui asser fuerit assignata quia tribus illa nunquam possedit eam
343,561,0.15311891950979484,habitatores tamen loci illius ydumei dicti sunt sicut et alii posteri esau,sed nunc tempore ibi pauci sunt habitatores pro tanta capacitate ciuitatis quia habitatores eius sunt continue in timore
344,777,0.09537748049389272,ab edom ydumei dicebantur unde antipater et filius eius herodes ascalonica ydumei dicebantur,inde 4 leucis contra meridiem dora ciuitas nunc assur dicta quondam tamen antipatrida dicta fuit ab herode antipatri filio et fuit milicie hospitalis qui licet eam perdiderint soluunt domino de assur et heredibus eius 34 milia bisanciorum singulis annis usque in eternum
345,172,0.22443870215603975,et hec de hac materia dicta sufficiant,et licet multum ultra processerim uersus gurgiam que olim capadocia dicebatur et armeniam et syciliam tamen de terris illis nichil scribo quia tota mea intencio uersatur circa descriptionem terre sancte et hec de hiis locis dicta sufficiant
346,307,0.581916683411981,terminatur autem mons iste in sorte tribus gad in monte galaad contra locum illum ubi non longe a montibus gelboe iuxta ciuitatem bethsan iordanis fluuius mare galilee egreditur et deinceps litus iordanis orientale est duarum tribuum et dimidie usque ad campestria moab sub monte abarim in sechim contra iericho,monte quousque uisus hominis se extendit terminaturque terra illa in sorte tribus gad que possedit terram ogis regis basan et montem galaad contra illum locum ubi non longe a montibus gelboe iuxta ciuitatem bersan iordanis egreditur mare galilee et de <incitus> inceps est litus iordanis orientale duarum tribuum et dimidie usque ad campestria moab supra iordanem sub monte abarym siue pasca contra iericho
347,308,0.2606230587863033,ultra uero contra austrum procedendo in litore eodem iordanis est terra moab usque ad petram deserti que nunc krach dicitur,ultra uero uersus <uero> austrum procedendo est situm idem usque ad finem iordanis et inde per totam longitudinem maris mortui usque ad montem regalem qui antiquitus petra deserti dicebatur
348,309,0.5546292148996961,postea pars quedam terre amon succedit quamdiu durat mare mortuum et sic circuit litus eius australe usque ad montem seyr illum qui coniunctus est deserto pharan iuxta cades barne habens a latere desertum sanay et mare rubrum,de regno moab postea sequitur terra filiorum amon in eodem litore quam diu durat mare mortuum et sic circuithtus eius <h> australe usque ad montem seyr alium qui coniunctus est deserto pharan usque cades barne habens a latere desertum synai
349,207,0.6106644402104109,secunda diuisio quarte orientalis,de diuisione quarte orientalis
350,310,0.5120116772586325,in secunda diuisione quarte orientalis primo orientalis accon procedendo contra euroaustrum ad 4 leucas de accon est chana galilee ubi dominus conuertit aquas in uinum et ostenditur ibidem hodie locus ubi steterunt 6 ydree et triclinium in quo erant mense,tertia pars quarte orientalis cana galilee in tertia parte orientalis quarte contra eurum post de achon ad 4 leucas est chana galilee ubi conuertit dominus aquas in uinum et ostenditur hodie locus in quo steterunt 6 ydrie et interclinium ubi erant mense
351,311,0.5336948883271327,sunt tamen hec loca sicut omnia alia fere in quibus dominus est aliquid operatus sub terra et descenditur ad ea in criptam per plures gradus sicut est locus annunciationis natiuitatis et iste in chana galilee et plura alia que ostenduntur sub terra,sunt tamen hec loca sicud fere omnia in quibus dominus est aliquid operatus sub terra et descenditur ad ea in terra per multos gradus
352,313,0.5554379432775998,cuius rei aliam non inuenio causam nisi quia per frequentes destructiones ecclesiarum in quibus erant loca ipsa ruine sunt supra terram exaltate et eis sic qualitercumque conplanatis alia edificia desuper sunt constructa,cuius aliam rationem non inuenio nisi quod per frequentes destructiones ruine sunt super terram exaltate et sic eis qualitercumque complanetis alia edificia sunt desuper locata
353,314,0.7540960917331112,christiani uero habentes deuotionem uisitandi loca sancta et uolentes ad uera loca ubi res gesta est peruenire oportuit ut emundarent loca ad gradus faciendos ut sic ad ea peruenirent,christiani uero habentes deuotionem uisitandi loca sancta uolentes ad uera loca ubi res est gesta peruenire oportebat ut erudarerent loca ad gradus faciendos ut sic ad ea peruenirent et ideo omnia loca ista quasi in criptis esse uidentur
354,314,0.3374296023917148,et ideo fere omnia loca ista quasi in criptis uidentur esse,christiani uero habentes deuotionem uisitandi loca sancta uolentes ad uera loca ubi res est gesta peruenire oportebat ut erudarerent loca ad gradus faciendos ut sic ad ea peruenirent et ideo omnia loca ista quasi in criptis esse uidentur
355,315,0.3827783659623016,chana galilee ab aquilone montem habet altum et rotundum et est in decliui latere eius sita,cana galilee autem ab aquilone habet montem altum et rotundum qui uidetur longe in mari et est in decliui latere eius sita sub se habet campum et planiciem ualde pulcram et fertilem quam iosephus carmeleum appellat quia extenditur usque ad carmelum et inde in sephorum per multa miliaria et crescit ibi lana succida et uinum delicatum et oliueta et uineta multa nimis
356,315,0.3468021667926199,sub se uero contra austrum habet campum et planiciem ualde pulchram quam iosephus appellat carmelion usque in sephorum fertilem nimis et amenum ualde,cana galilee autem ab aquilone habet montem altum et rotundum qui uidetur longe in mari et est in decliui latere eius sita sub se habet campum et planiciem ualde pulcram et fertilem quam iosephus carmeleum appellat quia extenditur usque ad carmelum et inde in sephorum per multa miliaria et crescit ibi lana succida et uinum delicatum et oliueta et uineta multa nimis
357,322,0.33858075490823764,de chana galilee 2 leucis contra meridiem fere in uia que de sephoro tyberiadem ducit est uilla quedam roma nomine in qua ionas propheta dicitur sepultus fuisse,de chana galilee 4 leucis contra meridiem uia que sephore ducit thiberiadem est uilla quedam dicta ruina ubi thobias propheta fuit tumulatus qui de terra ista natus fuit scilicet de geth que est in ciphel sicud enim appellatur terra ista
358,323,0.5256771157162451,uilla ista sita est sub monte qui nazareth ueniens includit predictum uallem carmeleon a parte australi,uilla ista sita est in monte qui de nazareth ueniens predictam uillam includit carmelam ut dictum est supra
359,317,0.3869193144526292,de roma ad 1 leucam et fere dimidiam contra orientem est uilla grandis quondam ut uidetur nomine abelina de qua legitur in iudith quod holofernes uadens contra bethuliam uenit secus eam,beelma de chana galilee uersus orientem est beelma ad 5 leucas de qua legitur in iudith quod holofernes uadens contra bethuliam uenit iuxta eam et sic oportebat quia propter locorum difficultatem uia alia esse non poterat
360,317,0.4521254917323048,et sic oportebat quia propter difficultatem locorum uia alia illuc esse non poterat,beelma de chana galilee uersus orientem est beelma ad 5 leucas de qua legitur in iudith quod holofernes uadens contra bethuliam uenit iuxta eam et sic oportebat quia propter locorum difficultatem uia alia esse non poterat
361,318,0.24360699673823277,de hac uilla creditur oriundus fuisse heliseus propheta sicut dicitur 3 regum 19 et est in constracta illa que uocatur dothaym distans de ipsa uilla dothaym per modicam leucam contra occidentem,est autem uilla ista in contracta illa uocatur dotaym distans ab ipsa per leucam et plus contra occidentem et sunt ibi ruine magne cuius ruine adhuc ostendunt eam magnam fuisse
362,698,0.23454861681473876,sunt in ea columpne multe marmoree et ruine magne que omnia ostendunt eam fuisse gloriosam et est in loco alto et firmo sita,sunt 2 in ea columpne marmoree nobilissime magnitudine et altitudine stupende
363,325,0.6155639789783451,de abelma ad 1 leucam bonam est mons bethulie ubi iudith occidit holofernem,mons bethulie inde ad 3 leucis est mons bethulie ubi iudit occidit holofernem
364,326,0.8804411810498657,qui mons per totam fere galileam uidetur pulcher ualde et munitus,qui mons per totam fere galileam uidetur pulcher ualde et firmus
365,327,0.5923852717949952,sunt in eo adhuc plura edificia et ruine plures,sunt in eo adhuc pluria edificia et ruine multe sed sunt omnia deserta
366,222,0.12666198076826912,in fine montis adhuc castellum pro tuitione montis ibi factum,castellum iudith secunda diuisio est contra orientem cuius prima pars procedit de achon contra uulturnum et in hac 4 leucis ab achon distat castellum iudith dictum
